{
  "id": "doc-cpc-2025",
  "title": "Consumer Protection Code 2025",
  "publisher": "Central Bank of Ireland",
  "published_date": "2025-03-24",
  "source_url": "https://www.centralbank.ie/publication/consultation-papers/cp158---consultation-paper-on-the-consumer-protection-code",
  "supersedes": "doc-cpc-2012"
}
