{
  "id": "doc-cpc-2012",
  "title": "Consumer Protection Code 2012",
  "publisher": "Central Bank of Ireland",
  "published_date": "2012-01-01",
  "source_url": "https://www.centralbank.ie/publication/consultation-papers/cp47-review-of-consumer-protection-code",
  "active_chunking_generation_id": "gen-cpc-2012-v2"
}
